{
  "$schema": "https://json-schema.org/draft/2020-12/schema",
  "$id": "https://example.local/schemas/go/improvement_candidate.schema.json",
  "title": "ImprovementCandidate",
  "description": "A reviewable artifact produced by an adjacent skill (/friction, /behave, /skeptic, /dne, /evolve, /genius, /go, manual) proposing a change to /go or another skill. A passing validate_improvement_candidate.py run means the file is well-formed. It does NOT approve, schedule, or auto-promote the candidate. Review is a separate human step.",
  "type": "object",
  "additionalProperties": false,
  "required": [
    "candidate_id",
    "created_at",
    "source_skill",
    "observed_problem",
    "evidence",
    "evidence_tier",
    "frequency",
    "affected_layer",
    "target_skill_or_system",
    "candidate_type",
    "proposed_change",
    "target_layer",
    "mechanism_trace",
    "confidence",
    "risk",
    "expected_benefit",
    "failure_mode_prevented",
    "falsification_condition",
    "promotion_requirements",
    "recommended_destination",
    "review_status"
  ],
  "properties": {
    "candidate_id": {
      "type": "string",
      "pattern": "^IC-(?:BEH|DNE|EVL|FRI|GEN|GO|MAN|SKP)-[A-Za-z0-9._:-]{1,64}$",
      "description": "Format: IC-<KEY>-<LOCAL>. KEY is the source skill (BEH/DNE/EVL/FRI/GEN/GO/MAN/SKP). LOCAL is a slug (1-64 chars from [A-Za-z0-9._:-])."
    },
    "created_at": {
      "type": "string",
      "format": "date-time",
      "description": "ISO-8601 timestamp of creation."
    },
    "source_skill": {
      "type": "string",
      "enum": ["go", "friction", "behave", "skeptic", "dne", "evolve", "genius", "manual"]
    },
    "source_session_or_run_id": {
      "type": ["string", "null"],
      "description": "Optional pointer to the session/run that surfaced the candidate."
    },
    "observed_problem": {
      "type": "string",
      "minLength": 1,
      "description": "One-sentence symptom statement."
    },
    "evidence": {
      "type": "array",
      "items": { "type": "string", "minLength": 1 },
      "minItems": 1,
      "description": "Citations: file:line, command output, transcript excerpt, or 'not found'. REQUIRED for verified/inferred tiers."
    },
    "evidence_tier": {
      "type": "string",
      "enum": [
        "execution_artifact",
        "official_doc_or_spec",
        "source_inspection",
        "test_result",
        "user_report",
        "inference",
        "memory_or_unverified"
      ],
      "description": "Strength of the strongest citation in `evidence`. `confidence` must be calibrated against this tier."
    },
    "frequency": {
      "type": "string",
      "minLength": 1,
      "description": "How often the problem was observed: 'once', 'N times in window', 'always', etc. Free-text; structured counts are the producer's responsibility."
    },
    "affected_layer": {
      "type": "string",
      "enum": [
        "prompt_only",
        "docs",
        "report_contract",
        "validation_script",
        "advisory_review",
        "runtime_gate",
        "hook",
        "orchestrator",
        "skill_handoff",
        "modernization_campaign",
        "do_not_implement"
      ],
      "description": "Layer the problem lives on. May differ from target_layer (e.g., problem on `hook`, change on `prompt_only`)."
    },
    "target_skill_or_system": {
      "type": "string",
      "minLength": 1,
      "description": "Name of the skill/system the proposal targets (e.g. 'go', 'dne', 'orchestrator')."
    },
    "candidate_type": {
      "type": "string",
      "enum": [
        "workflow_friction",
        "llm_behavior_failure",
        "semantic_coverage_gap",
        "overclaim_or_evidence_gap",
        "technical_debt",
        "risk_model",
        "hook_candidate",
        "skill_handoff_rule",
        "documentation_gap",
        "runtime_gate_candidate",
        "cleanup_candidate"
      ],
      "description": "Class of the proposal."
    },
    "proposed_change": {
      "type": "string",
      "minLength": 1,
      "description": "Concrete description of the proposed change. NOT implementation; this is a reviewable artifact."
    },
    "target_layer": {
      "type": "string",
      "enum": [
        "prompt_only",
        "docs",
        "report_contract",
        "validation_script",
        "advisory_review",
        "runtime_gate",
        "hook",
        "orchestrator",
        "skill_handoff",
        "modernization_campaign",
        "do_not_implement"
      ],
      "description": "Layer the proposal, if implemented, would modify. Drives the mechanism_trace and promotion_requirements requirements."
    },
    "mechanism_trace": {
      "description": "Structured producer → artifact/state → consumer → authority → freshness → failure-direction → real-boundary-test trace. Required (non-null with null_reason OR full trace object) when target_layer ∈ {runtime_gate, hook, orchestrator, validation_script}. May be JSON null or the null-variant object for pure ideas/observations on lower-risk layers.",
      "oneOf": [
        { "type": "null" },
        { "$ref": "#/$defs/MechanismTrace" },
        {
          "type": "object",
          "required": ["null", "null_reason"],
          "additionalProperties": true,
          "properties": {
            "null": { "const": true },
            "null_reason": { "type": "string", "minLength": 1 }
          }
        }
      ]
    },
    "confidence": {
      "type": "string",
      "enum": ["low", "medium", "high"],
      "description": "Calibrated against evidence_tier: high requires execution_artifact/official_doc_or_spec/source_inspection/test_result + reproduction."
    },
    "risk": {
      "type": "string",
      "enum": ["low", "medium", "high", "critical"],
      "description": "Risk of acting on the candidate without further review."
    },
    "expected_benefit": {
      "type": "string",
      "minLength": 1,
      "description": "Plain-English upside, scoped and falsifiable."
    },
    "failure_mode_prevented": {
      "type": "string",
      "minLength": 1,
      "description": "What failure this candidate is expected to prevent or reduce."
    },
    "falsification_condition": {
      "type": "string",
      "minLength": 1,
      "description": "The observation/measurement that would show this candidate is wrong or ineffective."
    },
    "promotion_requirements": {
      "type": "object",
      "additionalProperties": false,
      "required": ["reviewer_acceptance", "evidence_basis", "items"],
      "properties": {
        "reviewer_acceptance": {
          "type": "boolean",
          "description": "True iff a reviewer has signed off. False for proposed/needs_evidence candidates."
        },
        "evidence_basis": {
          "type": "string",
          "minLength": 1,
          "description": "What evidence the reviewer should weigh."
        },
        "items": {
          "type": "array",
          "description": "Checklist the reviewer must complete before promotion. Required keys depend on target_layer (see validator). When review_status='implemented', every item must have satisfied=true and evidence.",
          "items": {
            "type": "object",
            "additionalProperties": false,
            "required": ["key", "description"],
            "properties": {
              "key": { "type": "string", "minLength": 1 },
              "description": { "type": "string", "minLength": 1 },
              "satisfied": { "type": "boolean", "default": false },
              "evidence": { "type": "string", "description": "Citation when satisfied=true. Required for review_status='implemented'." }
            }
          }
        }
      }
    },
    "recommended_destination": {
      "type": "string",
      "enum": [
        "prompt_only",
        "docs",
        "report_contract",
        "validation_script",
        "advisory_review",
        "runtime_gate",
        "hook",
        "orchestrator",
        "skill_handoff",
        "modernization_campaign",
        "do_not_implement"
      ],
      "description": "Layer the candidate's author recommends acting on first."
    },
    "review_status": {
      "type": "string",
      "enum": ["proposed", "needs_evidence", "accepted_for_backlog", "rejected", "implemented", "superseded"],
      "description": "Where this candidate sits in the review lifecycle. 'proposed' does NOT imply implementation; promotion requires a separate, explicit task."
    },
    "reviewer_notes": {
      "type": "string",
      "description": "Free-form notes from reviewers. Append-only."
    }
  },
  "$defs": {
    "MechanismTrace": {
      "type": "object",
      "additionalProperties": false,
      "required": [
        "producer",
        "artifact_or_state",
        "consumer",
        "authority_or_verdict",
        "freshness_check",
        "failure_direction",
        "real_boundary_test"
      ],
      "properties": {
        "producer": { "type": "string", "minLength": 1, "description": "What writes/creates the affected behavior (e.g. 'orchestrate.dispatch_claude()')." },
        "artifact_or_state": { "type": "string", "minLength": 1, "description": "Stored artifact/state path (e.g. 'claude-task-request_{RUN_ID}.json')." },
        "consumer": { "type": "string", "minLength": 1, "description": "What reads it (e.g. 'go_delegation_enforce_PreToolUse.py')." },
        "authority_or_verdict": { "type": "string", "minLength": 1, "description": "Who decides the verdict (e.g. 'PreToolUse gate', 'deterministic continuation gate')." },
        "freshness_check": { "type": "string", "minLength": 1, "description": "How staleness is detected (e.g. 'assert_fresh(proposal, run_id)')." },
        "failure_direction": { "type": "string", "minLength": 1, "description": "Where the failure goes on missing/stale (silent allow / hard block / advisory-only)." },
        "real_boundary_test": { "type": "string", "minLength": 1, "description": "How the claim is verified at the real boundary, not a unit test (e.g. 'spawned Agent() with tools omitted from schema')." }
      }
    }
  }
}